============================== Prover9 ===============================
Prover9 (64) version 2009-11A, November 2009.
Process 21639 was started by torsten on stl-ws2,
Thu Jul  5 18:09:19 2012
The command was "prover9 -t 600 -f inch/p9/inch_original.p9 inch/p9/inch_weak_closed.p9 inch/p9/inch_weak.p9 inch//theorems/p9/options.txt inch//theorems/p9/inch_original_theorems_20.p9".
============================== end of head ===========================

============================== INPUT =================================

% Reading from file inch/p9/inch_original.p9


formulas(sos).
(all x all y all z (INCH(x,y) & INCH(y,z) & INCH(z,x) -> INCH(y,x))).
(all x all y (INCH(x,y) -> (exists z (CS(z,x) & INCH(z,y) & INCH(y,z))))).
(all x all y (CH(x,y) -> CS(x,y))).
end_of_list.

% Reading from file inch/p9/inch_weak_closed.p9


formulas(sos).
(all x all y (GED(x,y) & GED(y,x) -> (exists z all w (INCH(z,w) <-> INCH(x,w) | INCH(y,w))))).
(all x all y (GED(x,y) & GED(y,x) -> (exists z all w (INCH(z,w) <-> (exists v (INCH(v,w) & CH(v,x) & -(INCH(v,y) & INCH(y,v)))))))).
end_of_list.

% Reading from file inch/p9/inch_weak.p9


formulas(sos).
(all x all y (CS(x,y) <-> (all z (INCH(x,z) -> INCH(y,z))))).
(all x all y (CH(x,y) <-> INCH(x,y) & (all z (INCH(x,z) & INCH(z,x) -> INCH(y,z) & INCH(z,y))))).
(all x all y (ZEXI(x) <-> -INCH(x,x))).
(all x all y (GED(x,y) <-> ZEXI(y) | (exists z (INCH(x,z) & INCH(z,y))))).
(all x all y (x = y <-> (all z (INCH(x,z) <-> INCH(y,z))))).
(all x all y (x = y <-> (all z (INCH(z,x) <-> INCH(z,y))))).
(all x all y (INCH(x,y) -> INCH(x,x))).
(all x all y (GED(x,y) | GED(y,x))).
(all x all y all z (GED(x,y) & GED(y,z) -> GED(x,z))).
end_of_list.

% Reading from file inch//theorems/p9/options.txt

clear(auto_denials).
clear(print_initial_clauses).
clear(print_kept).
clear(print_given).

% Reading from file inch//theorems/p9/inch_original_theorems_20.p9


formulas(goals).
(all x all y ((all z (CH(z,x) -> CS(z,y))) -> CS(x,y))).
end_of_list.

============================== end of input ==========================

% From the command line: assign(max_seconds, 600).

============================== PROCESS NON-CLAUSAL FORMULAS ==========

% Formulas that are not ordinary clauses:
1 (all x all y all z (INCH(x,y) & INCH(y,z) & INCH(z,x) -> INCH(y,x))) # label(non_clause).  [assumption].
2 (all x all y (INCH(x,y) -> (exists z (CS(z,x) & INCH(z,y) & INCH(y,z))))) # label(non_clause).  [assumption].
3 (all x all y (CH(x,y) -> CS(x,y))) # label(non_clause).  [assumption].
4 (all x all y (GED(x,y) & GED(y,x) -> (exists z all w (INCH(z,w) <-> INCH(x,w) | INCH(y,w))))) # label(non_clause).  [assumption].
5 (all x all y (GED(x,y) & GED(y,x) -> (exists z all w (INCH(z,w) <-> (exists v (INCH(v,w) & CH(v,x) & -(INCH(v,y) & INCH(y,v)))))))) # label(non_clause).  [assumption].
6 (all x all y (CS(x,y) <-> (all z (INCH(x,z) -> INCH(y,z))))) # label(non_clause).  [assumption].
7 (all x all y (CH(x,y) <-> INCH(x,y) & (all z (INCH(x,z) & INCH(z,x) -> INCH(y,z) & INCH(z,y))))) # label(non_clause).  [assumption].
8 (all x all y (ZEXI(x) <-> -INCH(x,x))) # label(non_clause).  [assumption].
9 (all x all y (GED(x,y) <-> ZEXI(y) | (exists z (INCH(x,z) & INCH(z,y))))) # label(non_clause).  [assumption].
10 (all x all y (x = y <-> (all z (INCH(x,z) <-> INCH(y,z))))) # label(non_clause).  [assumption].
11 (all x all y (x = y <-> (all z (INCH(z,x) <-> INCH(z,y))))) # label(non_clause).  [assumption].
12 (all x all y (INCH(x,y) -> INCH(x,x))) # label(non_clause).  [assumption].
13 (all x all y (GED(x,y) | GED(y,x))) # label(non_clause).  [assumption].
14 (all x all y all z (GED(x,y) & GED(y,z) -> GED(x,z))) # label(non_clause).  [assumption].
15 (all x all y ((all z (CH(z,x) -> CS(z,y))) -> CS(x,y))) # label(non_clause) # label(goal).  [goal].

============================== end of process non-clausal formulas ===

============================== PROCESS INITIAL CLAUSES ===============

============================== PREDICATE ELIMINATION =================

Eliminating ZEXI/1
16 ZEXI(x) | INCH(x,x).  [clausify(8)].
17 -ZEXI(x) | -INCH(x,x).  [clausify(8)].
18 -GED(x,y) | ZEXI(y) | INCH(x,f7(x,y)).  [clausify(9)].
Derived: -GED(x,y) | INCH(x,f7(x,y)) | -INCH(y,y).  [resolve(18,b,17,a)].
19 -GED(x,y) | ZEXI(y) | INCH(f7(x,y),y).  [clausify(9)].
Derived: -GED(x,y) | INCH(f7(x,y),y) | -INCH(y,y).  [resolve(19,b,17,a)].
20 GED(x,y) | -ZEXI(y).  [clausify(9)].
Derived: GED(x,y) | INCH(y,y).  [resolve(20,b,16,a)].
Derived: GED(x,y) | -GED(z,y) | INCH(z,f7(z,y)).  [resolve(20,b,18,b)].
Derived: GED(x,y) | -GED(z,y) | INCH(f7(z,y),y).  [resolve(20,b,19,b)].

============================== end predicate elimination =============

Term ordering decisions:
Predicate symbol precedence:  predicate_order([ =, INCH, GED, CH, CS ]).
Function symbol precedence:  function_order([ c1, c2, f1, f2, f3, f5, f6, f7, f8, f9, f4 ]).
After inverse_order:  (no changes).
Unfolding symbols: (none).

Auto_inference settings:
  % set(paramodulation).  % (positive equality literals)
  % set(binary_resolution).  % (non-Horn)
  % set(neg_ur_resolution).  % (non-Horn, less than 100 clauses)

Auto_process settings:
  % set(factor).  % (non-Horn)
  % set(unit_deletion).  % (non-Horn)

============================== end of process initial clauses ========

============================== CLAUSES FOR SEARCH ====================

============================== end of clauses for search =============

============================== SEARCH ================================

% Starting search at 0.00 seconds.

============================== PROOF =================================

% Proof 1 at 0.01 (+ 0.00) seconds.
% Length of proof is 17.
% Level of proof is 5.
% Maximum clause weight is 16.000.
% Given clauses 58.

6 (all x all y (CS(x,y) <-> (all z (INCH(x,z) -> INCH(y,z))))) # label(non_clause).  [assumption].
7 (all x all y (CH(x,y) <-> INCH(x,y) & (all z (INCH(x,z) & INCH(z,x) -> INCH(y,z) & INCH(z,y))))) # label(non_clause).  [assumption].
12 (all x all y (INCH(x,y) -> INCH(x,x))) # label(non_clause).  [assumption].
15 (all x all y ((all z (CH(z,x) -> CS(z,y))) -> CS(x,y))) # label(non_clause) # label(goal).  [goal].
35 CS(x,y) | INCH(x,f5(x,y)).  [clausify(6)].
40 CH(x,y) | -INCH(x,y) | INCH(x,f6(x,y)).  [clausify(7)].
41 CH(x,y) | -INCH(x,y) | INCH(f6(x,y),x).  [clausify(7)].
42 CH(x,y) | -INCH(x,y) | -INCH(y,f6(x,y)) | -INCH(f6(x,y),y).  [clausify(7)].
52 -INCH(x,y) | INCH(x,x).  [clausify(12)].
55 -CH(x,c1) | CS(x,c2).  [deny(15)].
56 -CS(c1,c2).  [deny(15)].
143 INCH(c1,f5(c1,c2)).  [resolve(56,a,35,a)].
144 -CH(c1,c1).  [ur(55,b,56,a)].
191 INCH(c1,c1).  [resolve(143,a,52,a)].
211 INCH(f6(c1,c1),c1).  [resolve(191,a,41,b),unit_del(a,144)].
212 INCH(c1,f6(c1,c1)).  [resolve(191,a,40,b),unit_del(a,144)].
237 $F.  [resolve(211,a,42,d),unit_del(a,144),unit_del(b,191),unit_del(c,212)].

============================== end of proof ==========================

============================== STATISTICS ============================

Given=58. Generated=341. Kept=216. proofs=1.
Usable=58. Sos=144. Demods=0. Limbo=7, Disabled=53. Hints=0.
Kept_by_rule=0, Deleted_by_rule=0.
Forward_subsumed=124. Back_subsumed=1.
Sos_limit_deleted=0. Sos_displaced=0. Sos_removed=0.
New_demodulators=0 (0 lex), Back_demodulated=0. Back_unit_deleted=6.
Demod_attempts=0. Demod_rewrites=0.
Res_instance_prunes=0. Para_instance_prunes=0. Basic_paramod_prunes=0.
Nonunit_fsub_feature_tests=408. Nonunit_bsub_feature_tests=621.
Megabytes=0.43.
User_CPU=0.01, System_CPU=0.00, Wall_clock=0.

============================== end of statistics =====================

============================== end of search =========================

THEOREM PROVED

Exiting with 1 proof.

Process 21639 exit (max_proofs) Thu Jul  5 18:09:19 2012
