============================== Prover9 ===============================
Prover9 (64) version 2009-11A, November 2009.
Process 14309 was started by torsten on stl-ws2,
Mon Aug 27 16:05:09 2012
The command was "prover9 -t 600 -f btw/p9/btw_orderable.p9 btw/p9/btw_basic.p9 btw//theorems/p9/options.txt btw//theorems/p9/btw_orderable_theorems_1.p9".
============================== end of head ===========================

============================== INPUT =================================

% Reading from file btw/p9/btw_orderable.p9


formulas(sos).
(all r all a all b all c (a != b & a != c & b != c -> Btw(r,a,b,c) | Btw(r,a,c,b) | Btw(r,b,a,c))).
end_of_list.

% Reading from file btw/p9/btw_basic.p9


formulas(sos).
(all r all a all b all c (Btw(r,a,b,c) -> a != b & a != c & b != c)).
(all r all a all b all c (Btw(r,a,b,c) -> Btw(r,c,b,a))).
(all r all a all b all c (Btw(r,a,b,c) -> -Btw(r,a,c,b))).
(all r all a all b all x all y (Btw(r,x,a,b) & Btw(r,a,b,y) -> Btw(r,x,a,y))).
(all r all a all b all x all y (Btw(r,x,a,b) & Btw(r,a,y,b) -> Btw(r,x,a,y))).
end_of_list.

% Reading from file btw//theorems/p9/options.txt

clear(auto_denials).
clear(print_initial_clauses).
clear(print_kept).
clear(print_given).

% Reading from file btw//theorems/p9/btw_orderable_theorems_1.p9


formulas(goals).
(all r all a all b all c all x (Btw(r,a,x,b) & Btw(r,a,x,c) -> -Btw(r,b,x,c))).
end_of_list.

============================== end of input ==========================

% From the command line: assign(max_seconds, 600).

============================== PROCESS NON-CLAUSAL FORMULAS ==========

% Formulas that are not ordinary clauses:
1 (all r all a all b all c (a != b & a != c & b != c -> Btw(r,a,b,c) | Btw(r,a,c,b) | Btw(r,b,a,c))) # label(non_clause).  [assumption].
2 (all r all a all b all c (Btw(r,a,b,c) -> a != b & a != c & b != c)) # label(non_clause).  [assumption].
3 (all r all a all b all c (Btw(r,a,b,c) -> Btw(r,c,b,a))) # label(non_clause).  [assumption].
4 (all r all a all b all c (Btw(r,a,b,c) -> -Btw(r,a,c,b))) # label(non_clause).  [assumption].
5 (all r all a all b all x all y (Btw(r,x,a,b) & Btw(r,a,b,y) -> Btw(r,x,a,y))) # label(non_clause).  [assumption].
6 (all r all a all b all x all y (Btw(r,x,a,b) & Btw(r,a,y,b) -> Btw(r,x,a,y))) # label(non_clause).  [assumption].
7 (all r all a all b all c all x (Btw(r,a,x,b) & Btw(r,a,x,c) -> -Btw(r,b,x,c))) # label(non_clause) # label(goal).  [goal].

============================== end of process non-clausal formulas ===

============================== PROCESS INITIAL CLAUSES ===============

============================== PREDICATE ELIMINATION =================

No predicates eliminated.

============================== end predicate elimination =============

Term ordering decisions:
Predicate symbol precedence:  predicate_order([ =, Btw ]).
Function symbol precedence:  function_order([ c1, c2, c3, c4, c5 ]).
After inverse_order:  (no changes).
Unfolding symbols: (none).

Auto_inference settings:
  % set(paramodulation).  % (positive equality literals)
  % set(binary_resolution).  % (non-Horn)
  % set(neg_ur_resolution).  % (non-Horn, less than 100 clauses)

Auto_process settings:
  % set(factor).  % (non-Horn)
  % set(unit_deletion).  % (non-Horn)

============================== end of process initial clauses ========

============================== CLAUSES FOR SEARCH ====================

============================== end of clauses for search =============

============================== SEARCH ================================

% Starting search at 0.00 seconds.

============================== PROOF =================================

% Proof 1 at 0.01 (+ 0.00) seconds.
% Length of proof is 28.
% Level of proof is 5.
% Maximum clause weight is 24.000.
% Given clauses 53.

1 (all r all a all b all c (a != b & a != c & b != c -> Btw(r,a,b,c) | Btw(r,a,c,b) | Btw(r,b,a,c))) # label(non_clause).  [assumption].
2 (all r all a all b all c (Btw(r,a,b,c) -> a != b & a != c & b != c)) # label(non_clause).  [assumption].
3 (all r all a all b all c (Btw(r,a,b,c) -> Btw(r,c,b,a))) # label(non_clause).  [assumption].
4 (all r all a all b all c (Btw(r,a,b,c) -> -Btw(r,a,c,b))) # label(non_clause).  [assumption].
6 (all r all a all b all x all y (Btw(r,x,a,b) & Btw(r,a,y,b) -> Btw(r,x,a,y))) # label(non_clause).  [assumption].
7 (all r all a all b all c all x (Btw(r,a,x,b) & Btw(r,a,x,c) -> -Btw(r,b,x,c))) # label(non_clause) # label(goal).  [goal].
8 x = y | z = y | z = x | Btw(u,y,x,z) | Btw(u,y,z,x) | Btw(u,x,y,z).  [clausify(1)].
10 -Btw(x,y,z,u) | u != y.  [clausify(2)].
12 -Btw(x,y,z,u) | Btw(x,u,z,y).  [clausify(3)].
13 -Btw(x,y,z,u) | -Btw(x,y,u,z).  [clausify(4)].
15 -Btw(x,y,z,u) | -Btw(x,z,w,u) | Btw(x,y,z,w).  [clausify(6)].
16 Btw(c1,c2,c5,c3).  [deny(7)].
17 Btw(c1,c2,c5,c4).  [deny(7)].
18 Btw(c1,c3,c5,c4).  [deny(7)].
25 Btw(x,y,z,u) | y = u | z = u | z = y | Btw(x,u,y,z) | Btw(x,y,u,z).  [resolve(12,a,8,e)].
43 -Btw(c1,c2,c3,c5).  [resolve(16,a,13,b)].
44 Btw(c1,c3,c5,c2).  [resolve(16,a,12,a)].
46 c3 != c2.  [resolve(16,a,10,a)].
48 -Btw(c1,x,c2,c4) | Btw(c1,x,c2,c5).  [resolve(17,a,15,b)].
52 -Btw(c1,c2,c4,c5).  [resolve(17,a,13,b)].
55 c4 != c2.  [resolve(17,a,10,a)].
61 Btw(c1,c4,c5,c3).  [resolve(18,a,12,a)].
62 c4 != c3.  [resolve(18,a,10,a)].
67 -Btw(c1,c3,c2,c5).  [resolve(44,a,13,b)].
87 -Btw(c1,c2,c3,c4).  [ur(15,b,18,a,c,43,a)].
88 -Btw(c1,c2,c4,c3).  [ur(15,b,61,a,c,52,a)].
102 -Btw(c1,c3,c2,c4).  [ur(48,b,67,a)].
162 $F.  [resolve(87,a,25,f),flip(b),unit_del(a,88),unit_del(b,46),unit_del(c,62),unit_del(d,55),unit_del(e,102)].

============================== end of proof ==========================

============================== STATISTICS ============================

Given=53. Generated=892. Kept=154. proofs=1.
Usable=53. Sos=101. Demods=0. Limbo=0, Disabled=11. Hints=0.
Kept_by_rule=0, Deleted_by_rule=0.
Forward_subsumed=737. Back_subsumed=0.
Sos_limit_deleted=0. Sos_displaced=0. Sos_removed=0.
New_demodulators=0 (0 lex), Back_demodulated=0. Back_unit_deleted=0.
Demod_attempts=0. Demod_rewrites=0.
Res_instance_prunes=0. Para_instance_prunes=0. Basic_paramod_prunes=0.
Nonunit_fsub_feature_tests=1214. Nonunit_bsub_feature_tests=1206.
Megabytes=0.25.
User_CPU=0.01, System_CPU=0.00, Wall_clock=0.

============================== end of statistics =====================

============================== end of search =========================

THEOREM PROVED

Exiting with 1 proof.

Process 14309 exit (max_proofs) Mon Aug 27 16:05:09 2012
