============================== Prover9 ===============================
Prover9 (64) version 2009-11A, November 2009.
Process 26267 was started by torsten on scotus.mie.utoronto.ca,
Wed Oct 24 23:01:15 2012
The command was "prover9 -t 600 -f oig/input/woig_2d.p9 oig/input/b_2d.p9 ig/input/ig_2d_lin.p9 ig/input/ig_2d_slin.p9 ig/input/ig_2d.p9 oig/theorems/input/options.txt oig/theorems/input/woig_2d_theorems_1.p9".
============================== end of head ===========================

============================== INPUT =================================

% Reading from file oig/input/woig_2d.p9


formulas(sos).
end_of_list.

% Reading from file oig/input/b_2d.p9


formulas(sos).
(all x all y (on(x,y) -> Pt(x) & -Pt(y))).
(all a all b all c (B(a,b,c) -> B(c,b,a))).
(all a all b all c (B(a,b,c) -> -B(b,c,a))).
(all a all b all c all p ((exists l (on(a,l) & on(b,l) & on(c,l))) & a != b & a != c & b != c <-> B(a,b,c) | B(b,c,a) | B(c,a,b))).
(all a all b all c all p all l (on(a,l) & on(b,l) & on(c,l) & on(p,l) & p != a & p != b & p != c & B(a,p,b) -> B(b,p,c) & -B(a,p,c) | B(a,p,c) & -B(b,p,c))).
end_of_list.

% Reading from file ig/input/ig_2d_lin.p9


formulas(sos).
(all x all y (Pt(x) & Pt(y) & x != y -> (exists z (L(z) & on(x,z) & on(y,z))))).
end_of_list.

% Reading from file ig/input/ig_2d_slin.p9


formulas(sos).
(all l all m all x all y (x != y & L(l) & L(m) & on(x,l) & on(y,l) & on(x,m) & on(y,m) -> l = m)).
end_of_list.

% Reading from file ig/input/ig_2d.p9


formulas(sos).
(all x all y (on(x,y) -> Pt(x) & -Pt(y))).
(all x (L(x) -> (exists y exists z (on(y,x) & on(z,x) & y != z)))).
end_of_list.

% Reading from file oig/theorems/input/options.txt

clear(auto_denials).
clear(print_initial_clauses).
clear(print_kept).
clear(print_given).

% Reading from file oig/theorems/input/woig_2d_theorems_1.p9


formulas(goals).
(all a all b all c (B(a,b,c) -> Pt(a))).
end_of_list.

============================== end of input ==========================

% From the command line: assign(max_seconds, 600).

============================== PROCESS NON-CLAUSAL FORMULAS ==========

% Formulas that are not ordinary clauses:
1 (all x all y (on(x,y) -> Pt(x) & -Pt(y))) # label(non_clause).  [assumption].
2 (all a all b all c (B(a,b,c) -> B(c,b,a))) # label(non_clause).  [assumption].
3 (all a all b all c (B(a,b,c) -> -B(b,c,a))) # label(non_clause).  [assumption].
4 (all a all b all c all p ((exists l (on(a,l) & on(b,l) & on(c,l))) & a != b & a != c & b != c <-> B(a,b,c) | B(b,c,a) | B(c,a,b))) # label(non_clause).  [assumption].
5 (all a all b all c all p all l (on(a,l) & on(b,l) & on(c,l) & on(p,l) & p != a & p != b & p != c & B(a,p,b) -> B(b,p,c) & -B(a,p,c) | B(a,p,c) & -B(b,p,c))) # label(non_clause).  [assumption].
6 (all x all y (Pt(x) & Pt(y) & x != y -> (exists z (L(z) & on(x,z) & on(y,z))))) # label(non_clause).  [assumption].
7 (all l all m all x all y (x != y & L(l) & L(m) & on(x,l) & on(y,l) & on(x,m) & on(y,m) -> l = m)) # label(non_clause).  [assumption].
8 (all x all y (on(x,y) -> Pt(x) & -Pt(y))) # label(non_clause).  [assumption].
9 (all x (L(x) -> (exists y exists z (on(y,x) & on(z,x) & y != z)))) # label(non_clause).  [assumption].
10 (all a all b all c (B(a,b,c) -> Pt(a))) # label(non_clause) # label(goal).  [goal].

============================== end of process non-clausal formulas ===

============================== PROCESS INITIAL CLAUSES ===============

============================== PREDICATE ELIMINATION =================

No predicates eliminated.

============================== end predicate elimination =============

Term ordering decisions:
Predicate symbol precedence:  predicate_order([ =, Pt, L, on, B ]).
Function symbol precedence:  function_order([ c1, c2, c3, f2, f3, f4, f1 ]).
After inverse_order:  (no changes).
Unfolding symbols: (none).

Auto_inference settings:
  % set(paramodulation).  % (positive equality literals)
  % set(binary_resolution).  % (non-Horn)
  % set(neg_ur_resolution).  % (non-Horn, less than 100 clauses)

Auto_process settings:
  % set(factor).  % (non-Horn)
  % set(unit_deletion).  % (non-Horn)

============================== end of process initial clauses ========

============================== CLAUSES FOR SEARCH ====================

============================== end of clauses for search =============

============================== SEARCH ================================

% Starting search at 0.01 seconds.

============================== PROOF =================================

% Proof 1 at 0.01 (+ 0.00) seconds.
% Length of proof is 10.
% Level of proof is 3.
% Maximum clause weight is 11.000.
% Given clauses 31.

1 (all x all y (on(x,y) -> Pt(x) & -Pt(y))) # label(non_clause).  [assumption].
4 (all a all b all c all p ((exists l (on(a,l) & on(b,l) & on(c,l))) & a != b & a != c & b != c <-> B(a,b,c) | B(b,c,a) | B(c,a,b))) # label(non_clause).  [assumption].
10 (all a all b all c (B(a,b,c) -> Pt(a))) # label(non_clause) # label(goal).  [goal].
11 -on(x,y) | Pt(x).  [clausify(1)].
16 on(x,f1(x,y,z,u)) | -B(x,y,z).  [clausify(4)].
40 B(c1,c2,c3).  [deny(10)].
41 -Pt(c1).  [deny(10)].
65 on(c1,f1(c1,c2,c3,x)).  [resolve(40,a,16,b)].
73 -on(c1,x).  [ur(11,b,41,a)].
74 $F.  [resolve(73,a,65,a)].

============================== end of proof ==========================

============================== STATISTICS ============================

Given=31. Generated=165. Kept=63. proofs=1.
Usable=31. Sos=23. Demods=0. Limbo=0, Disabled=44. Hints=0.
Kept_by_rule=0, Deleted_by_rule=0.
Forward_subsumed=102. Back_subsumed=4.
Sos_limit_deleted=0. Sos_displaced=0. Sos_removed=0.
New_demodulators=0 (0 lex), Back_demodulated=0. Back_unit_deleted=4.
Demod_attempts=0. Demod_rewrites=0.
Res_instance_prunes=0. Para_instance_prunes=0. Basic_paramod_prunes=0.
Nonunit_fsub_feature_tests=108. Nonunit_bsub_feature_tests=254.
Megabytes=0.17.
User_CPU=0.01, System_CPU=0.00, Wall_clock=0.

============================== end of statistics =====================

============================== end of search =========================

THEOREM PROVED

Exiting with 1 proof.

Process 26267 exit (max_proofs) Wed Oct 24 23:01:15 2012
