============================== Prover9 ===============================
Prover9 (64) version 2009-11A, November 2009.
Process 20892 was started by torsten on stl-ws2,
Thu Jul  5 17:57:24 2012
The command was "prover9 -t 600 -f inch/p9/inch_original.p9 inch/p9/inch_weak_closed.p9 inch/p9/inch_weak.p9 inch//theorems/p9/options.txt inch//theorems/p9/inch_original_theorems_5.p9".
============================== end of head ===========================

============================== INPUT =================================

% Reading from file inch/p9/inch_original.p9


formulas(sos).
(all x all y all z (INCH(x,y) & INCH(y,z) & INCH(z,x) -> INCH(y,x))).
(all x all y (INCH(x,y) -> (exists z (CS(z,x) & INCH(z,y) & INCH(y,z))))).
(all x all y (CH(x,y) -> CS(x,y))).
end_of_list.

% Reading from file inch/p9/inch_weak_closed.p9


formulas(sos).
(all x all y (GED(x,y) & GED(y,x) -> (exists z all w (INCH(z,w) <-> INCH(x,w) | INCH(y,w))))).
(all x all y (GED(x,y) & GED(y,x) -> (exists z all w (INCH(z,w) <-> (exists v (INCH(v,w) & CH(v,x) & -(INCH(v,y) & INCH(y,v)))))))).
end_of_list.

% Reading from file inch/p9/inch_weak.p9


formulas(sos).
(all x all y (CS(x,y) <-> (all z (INCH(x,z) -> INCH(y,z))))).
(all x all y (CH(x,y) <-> INCH(x,y) & (all z (INCH(x,z) & INCH(z,x) -> INCH(y,z) & INCH(z,y))))).
(all x all y (ZEXI(x) <-> -INCH(x,x))).
(all x all y (GED(x,y) <-> ZEXI(y) | (exists z (INCH(x,z) & INCH(z,y))))).
(all x all y (x = y <-> (all z (INCH(x,z) <-> INCH(y,z))))).
(all x all y (x = y <-> (all z (INCH(z,x) <-> INCH(z,y))))).
(all x all y (INCH(x,y) -> INCH(x,x))).
(all x all y (GED(x,y) | GED(y,x))).
(all x all y all z (GED(x,y) & GED(y,z) -> GED(x,z))).
end_of_list.

% Reading from file inch//theorems/p9/options.txt

clear(auto_denials).
clear(print_initial_clauses).
clear(print_kept).
clear(print_given).

% Reading from file inch//theorems/p9/inch_original_theorems_5.p9


formulas(goals).
(all x all y (CS(x,y) & -INCH(x,y) -> CS(x,y))).
end_of_list.

============================== end of input ==========================

% From the command line: assign(max_seconds, 600).

============================== PROCESS NON-CLAUSAL FORMULAS ==========

% Formulas that are not ordinary clauses:
1 (all x all y all z (INCH(x,y) & INCH(y,z) & INCH(z,x) -> INCH(y,x))) # label(non_clause).  [assumption].
2 (all x all y (INCH(x,y) -> (exists z (CS(z,x) & INCH(z,y) & INCH(y,z))))) # label(non_clause).  [assumption].
3 (all x all y (CH(x,y) -> CS(x,y))) # label(non_clause).  [assumption].
4 (all x all y (GED(x,y) & GED(y,x) -> (exists z all w (INCH(z,w) <-> INCH(x,w) | INCH(y,w))))) # label(non_clause).  [assumption].
5 (all x all y (GED(x,y) & GED(y,x) -> (exists z all w (INCH(z,w) <-> (exists v (INCH(v,w) & CH(v,x) & -(INCH(v,y) & INCH(y,v)))))))) # label(non_clause).  [assumption].
6 (all x all y (CS(x,y) <-> (all z (INCH(x,z) -> INCH(y,z))))) # label(non_clause).  [assumption].
7 (all x all y (CH(x,y) <-> INCH(x,y) & (all z (INCH(x,z) & INCH(z,x) -> INCH(y,z) & INCH(z,y))))) # label(non_clause).  [assumption].
8 (all x all y (ZEXI(x) <-> -INCH(x,x))) # label(non_clause).  [assumption].
9 (all x all y (GED(x,y) <-> ZEXI(y) | (exists z (INCH(x,z) & INCH(z,y))))) # label(non_clause).  [assumption].
10 (all x all y (x = y <-> (all z (INCH(x,z) <-> INCH(y,z))))) # label(non_clause).  [assumption].
11 (all x all y (x = y <-> (all z (INCH(z,x) <-> INCH(z,y))))) # label(non_clause).  [assumption].
12 (all x all y (INCH(x,y) -> INCH(x,x))) # label(non_clause).  [assumption].
13 (all x all y (GED(x,y) | GED(y,x))) # label(non_clause).  [assumption].
14 (all x all y all z (GED(x,y) & GED(y,z) -> GED(x,z))) # label(non_clause).  [assumption].
15 (all x all y (CS(x,y) & -INCH(x,y) -> CS(x,y))) # label(non_clause) # label(goal).  [goal].

============================== end of process non-clausal formulas ===

============================== PROCESS INITIAL CLAUSES ===============

============================== PREDICATE ELIMINATION =================

Eliminating CS/2
16 -CS(x,y) | -INCH(x,z) | INCH(y,z).  [clausify(6)].
17 -INCH(x,y) | CS(f1(x,y),x).  [clausify(2)].
18 -CH(x,y) | CS(x,y).  [clausify(3)].
19 CS(x,y) | INCH(x,f5(x,y)).  [clausify(6)].
20 CS(x,y) | -INCH(y,f5(x,y)).  [clausify(6)].

Eliminating CH/2
21 -GED(x,y) | -GED(y,x) | INCH(f3(x,y),z) | -INCH(u,z) | -CH(u,x) | INCH(u,y).  [clausify(5)].
22 -GED(x,y) | -GED(y,x) | -INCH(f3(x,y),z) | CH(f4(x,y,z),x).  [clausify(5)].
23 -GED(x,y) | -GED(y,x) | INCH(f3(x,y),z) | -INCH(u,z) | -CH(u,x) | INCH(y,u).  [clausify(5)].
24 -CH(x,y) | INCH(x,y).  [clausify(7)].
25 -CH(x,y) | -INCH(x,z) | -INCH(z,x) | INCH(y,z).  [clausify(7)].
26 -CH(x,y) | -INCH(x,z) | -INCH(z,x) | INCH(z,y).  [clausify(7)].
27 CH(x,y) | -INCH(x,y) | INCH(x,f6(x,y)).  [clausify(7)].
28 CH(x,y) | -INCH(x,y) | INCH(f6(x,y),x).  [clausify(7)].
29 CH(x,y) | -INCH(x,y) | -INCH(y,f6(x,y)) | -INCH(f6(x,y),y).  [clausify(7)].

Eliminating ZEXI/1
30 ZEXI(x) | INCH(x,x).  [clausify(8)].
31 -ZEXI(x) | -INCH(x,x).  [clausify(8)].
32 -GED(x,y) | ZEXI(y) | INCH(x,f7(x,y)).  [clausify(9)].
33 -GED(x,y) | ZEXI(y) | INCH(f7(x,y),y).  [clausify(9)].
34 GED(x,y) | -ZEXI(y).  [clausify(9)].

============================== end predicate elimination =============

Term ordering decisions:
Predicate symbol precedence:  predicate_order([ =, INCH, GED ]).
Function symbol precedence:  function_order([ f1, f2, f3, f8, f9, f4 ]).
After inverse_order:  (no changes).
Unfolding symbols: (none).

Auto_inference settings:
  % set(paramodulation).  % (positive equality literals)
  % set(binary_resolution).  % (non-Horn)
  % set(neg_ur_resolution).  % (non-Horn, less than 100 clauses)

Auto_process settings:
  % set(factor).  % (non-Horn)
  % set(unit_deletion).  % (non-Horn)

============================== PROOF =================================

% Proof 1 at 0.00 (+ 0.00) seconds.
% Length of proof is 2.
% Level of proof is 1.
% Maximum clause weight is 0.000.
% Given clauses 0.

15 (all x all y (CS(x,y) & -INCH(x,y) -> CS(x,y))) # label(non_clause) # label(goal).  [goal].
55 $F.  [deny(15)].

============================== end of proof ==========================

============================== STATISTICS ============================

Given=0. Generated=21. Kept=20. proofs=1.
Usable=0. Sos=0. Demods=0. Limbo=20, Disabled=40. Hints=0.
Kept_by_rule=0, Deleted_by_rule=0.
Forward_subsumed=0. Back_subsumed=0.
Sos_limit_deleted=0. Sos_displaced=0. Sos_removed=0.
New_demodulators=0 (0 lex), Back_demodulated=0. Back_unit_deleted=0.
Demod_attempts=0. Demod_rewrites=0.
Res_instance_prunes=0. Para_instance_prunes=0. Basic_paramod_prunes=0.
Nonunit_fsub_feature_tests=8. Nonunit_bsub_feature_tests=0.
Megabytes=0.12.
User_CPU=0.00, System_CPU=0.00, Wall_clock=0.

============================== end of statistics =====================

============================== end of search =========================

THEOREM PROVED

Exiting with 1 proof.

Process 20892 exit (max_proofs) Thu Jul  5 17:57:24 2012
